{
  "id": "mars-sextile-lilith",
  "transiting": "mars",
  "aspect": "sextile",
  "other": "lilith",
  "base": "A clean no can prevent the resentment created when agreement is given first and punished later.",
  "business": "A workable option is available; use the move that connects the two concerns.",
  "shadow": "The opportunity can remain unused if nobody makes the concrete move it requires.",
  "arcApplying": "The workable option becomes easier to recognize as exactness approaches.",
  "arcSeparating": "The opening becomes less immediate after exactness.",
  "voiceNeutral": true,
  "status": "LIVE",
  "readerCopy": {
    "summary": "A clean no can prevent the resentment created when agreement is given first and punished later.",
    "body": "A clean no can prevent the resentment created when agreement is given first and punished later. When Mars sextiles Lilith, action and refusal cooperate, making it easier for a boundary, preference, or decision to become practical before anger has to carry it. A changed plan, declined task, corrected assumption, or different route can resolve the mismatch early. The action does not need drama; it needs enough clarity that nobody has to pay later for a boundary that was never stated.",
    "approvedVia": "bounded owner-approved collective Calendar batch sky-calendar-collective-approved-2026-09-07; packages/astro-knowledge/review/sky-calendar-collective-approved-2026-09-07/owner-batch-authorization.json; serving and Content Studio authorized by packages/astro-knowledge/review/sky-calendar-collective-approved-2026-09-07/owner-serving-authorization.json"
  }
}
