{
  "id": "jupiter-trine-north-node",
  "transiting": "jupiter",
  "aspect": "trine",
  "other": "north-node",
  "base": "A larger opportunity can arrive at the same time a bigger decision is ready to become practical.",
  "business": "A supportive opening is available here; use what becomes easier without assuming ease will do the work for you.",
  "shadow": "The ease of a trine can make the opening easy to miss, leave unused, or go unexamined.",
  "arcApplying": "Support and coordination build toward exactness.",
  "arcSeparating": "The opening begins to recede after exactness.",
  "voiceNeutral": true,
  "status": "LIVE",
  "readerCopy": {
    "summary": "A larger opportunity can arrive at the same time a bigger decision is ready to become practical.",
    "body": "A larger opportunity can arrive at the same time a bigger decision is ready to become practical. When Jupiter trines the North Node, expansion and forward movement reinforce each other, making education, travel, publishing, mentorship, a new role, or wider reach especially relevant to what comes next. The useful opportunity changes what becomes possible after the yes. Its scale is easier to trust when the time, money, and responsibilities can carry the larger plan too.",
    "approvedVia": "bounded owner-approved collective Calendar batch sky-calendar-collective-approved-2026-09-07; packages/astro-knowledge/review/sky-calendar-collective-approved-2026-09-07/owner-batch-authorization.json; serving and Content Studio authorized by packages/astro-knowledge/review/sky-calendar-collective-approved-2026-09-07/owner-serving-authorization.json"
  }
}
