{
  "id": "sun-opposition-mars",
  "transiting": "sun",
  "aspect": "opposition",
  "other": "mars",
  "tldr": "the Sun opposition Mars.",
  "traditional": "the Sun opposition Mars: a hard contact. Vitality, authority, and recognition works against action, conflict, and heat - obstruction, friction, and strained outcomes in these areas.",
  "modern": "Identity meets drive and aggression. Energy, assertion, and the will to act become central to the sense of self. Psychologically the opposition is inner tension to integrate: Rejected aggression gets projected outward or erupts as a short fuse, often with defiance of authority. The energy has to be learned and channeled rather than cut off. The growth is owning both sides instead of splitting them.",
  "cyclic": {
    "phase": "Full (culmination)",
    "meaning": "Selfhood and drive reach full awareness and face each other: culmination, objectivity, fulfillment or confrontation."
  },
  "business": "Friction in this area. Initiative and drive; the cost is friction with authority and a tendency to force things.",
  "shadow": "Egotism and needing to be the center collides with anger and recklessness; forcing or splitting it instead of working it through.",
  "arcApplying": "A confrontation builds; the other side comes fully into view.",
  "arcSeparating": "The standoff resolves into balance or a split.",
  "composedFrom": [
    "pair:sun-mars",
    "aspect:opposition"
  ],
  "provenance": {
    "traditional": "classical and traditional sources",
    "modern": "modern aspect cookbook (psychological / popular register)",
    "cyclic": "humanistic / process-oriented source (cyclic model)"
  },
  "voiceNeutral": true,
  "status": "LIVE",
  "base": "Someone else's urgency can turn a routine disagreement into a contest over who gets the final say.",
  "readerCopy": {
    "summary": "Someone else's urgency can turn a routine disagreement into a contest over who gets the final say.",
    "body": "Someone else's urgency can turn a routine disagreement into a contest over who gets the final say. When the Sun opposes Mars, purpose meets another source of action or pressure directly, making both sides more likely to defend authority instead of solving the problem. The conflict becomes easier to manage when the actual decision is kept separate from the adrenaline around it. Matching escalation rarely creates more leverage than returning to the concrete issue on the table.",
    "approvedVia": "bounded owner-approved collective Calendar batch sky-calendar-collective-approved-2026-09-07; packages/astro-knowledge/review/sky-calendar-collective-approved-2026-09-07/owner-batch-authorization.json; serving and Content Studio authorized by packages/astro-knowledge/review/sky-calendar-collective-approved-2026-09-07/owner-serving-authorization.json"
  }
}
