{
  "id": "moon-trine-venus",
  "transiting": "moon",
  "aspect": "trine",
  "other": "venus",
  "tldr": "the Moon trine Venus.",
  "traditional": "the Moon trine Venus: a soft contact. The body, home, and daily needs supports love, money, and pleasure \u2014 cooperation and favorable conditions in these areas.",
  "modern": "Feelings meet charm and pleasure. Warmth is expressed instinctively, with a strong love of comfort and beauty. The trine makes this a natural strength: Naturally charming and emotionally generous. The growth edge is not to coast on the ease.",
  "cyclic": {
    "phase": "Waxing / waning trine",
    "waxing": "Feeling and connection flow together with ease; respond to the opportunity.",
    "waning": "Distribute and give transmissible form to what feeling and connection have realized."
  },
  "business": "An opening in this area. Likable and warm; watch indulgence and shaky money instincts.",
  "shadow": "The ease lets moodiness and over-need and indulgence and vanity go unchecked, or the opening pass unused.",
  "arcApplying": "Ease and support build and arrive on their own.",
  "arcSeparating": "The ease withdraws; the flow passes, used or not.",
  "composedFrom": [
    "pair:moon-venus",
    "aspect:trine"
  ],
  "provenance": {
    "traditional": "classical and traditional sources",
    "modern": "modern aspect cookbook (psychological / popular register)",
    "cyclic": "humanistic / process-oriented source (cyclic model)"
  },
  "voiceNeutral": true,
  "status": "DRAFT",
  "base": "Feelings meet charm and pleasure. Warmth is expressed instinctively, with a strong love of comfort and beauty. The trine makes this a natural strength: Naturally charming and emotionally generous. The growth edge is not to coast on the ease."
}
