{
  "id": "jupiter-trine-chiron",
  "transiting": "jupiter",
  "aspect": "trine",
  "other": "chiron",
  "base": "Something that once created doubt can become useful experience instead of the main reason to hold back.",
  "business": "A supportive opening is available here; use what becomes easier without assuming ease will do the work for you.",
  "shadow": "The ease of a trine can make the opening easy to miss, leave unused, or go unexamined.",
  "arcApplying": "Support and coordination build toward exactness.",
  "arcSeparating": "The opening begins to recede after exactness.",
  "voiceNeutral": true,
  "status": "LIVE",
  "readerCopy": {
    "summary": "Something that once created doubt can become useful experience instead of the main reason to hold back.",
    "body": "Something that once created doubt can become useful experience instead of the main reason to hold back. When Jupiter trines Chiron, expansion and sensitivity reinforce each other, making difficult history relevant to teaching, applying, leading, trying again, or taking on a larger role. Earlier setbacks do not have to be called beneficial in order for the knowledge gained through them to matter. Growth can use the lesson without romanticizing the cost.",
    "approvedVia": "bounded owner-approved collective Calendar batch sky-calendar-collective-approved-2026-09-07; packages/astro-knowledge/review/sky-calendar-collective-approved-2026-09-07/owner-batch-authorization.json; serving and Content Studio authorized by packages/astro-knowledge/review/sky-calendar-collective-approved-2026-09-07/owner-serving-authorization.json"
  }
}
