{
  "id": "sun-trine-pluto",
  "transiting": "sun",
  "aspect": "trine",
  "other": "pluto",
  "tldr": "the Sun trine Pluto.",
  "traditional": "No classical doctrine: Pluto is a modern planet unknown to traditional astrology. Read from the modern and cyclic layers; treat this contact as a slow, generational background tone.",
  "modern": "Identity meets power and intensity. A magnetic, high-voltage presence that others react to immediately. The trine makes this a natural strength: Strength and depth, well-controlled. A natural aptitude for investigation, healing, and transformation. The growth edge is not to coast on the ease.",
  "cyclic": {
    "phase": "Waxing / waning trine",
    "waxing": "Selfhood and power flow together with ease; respond to the opportunity.",
    "waning": "Distribute and give transmissible form to what selfhood and power have realized."
  },
  "business": "An opening in this area. Real influence; the intensity tends to polarize people.",
  "shadow": "The ease lets egotism and needing to be the center and control and obsession go unchecked, or the opening pass unused.",
  "arcApplying": "Ease and support build and arrive on their own.",
  "arcSeparating": "The ease withdraws; the flow passes, used or not.",
  "composedFrom": [
    "pair:sun-pluto",
    "aspect:trine"
  ],
  "provenance": {
    "traditional": "classical and traditional sources",
    "modern": "modern aspect cookbook (psychological / popular register)",
    "cyclic": "humanistic / process-oriented source (cyclic model)"
  },
  "voiceNeutral": true,
  "status": "DRAFT",
  "base": "Identity meets power and intensity. A magnetic, high-voltage presence that others react to immediately. The trine makes this a natural strength: Strength and depth, well-controlled. A natural aptitude for investigation, healing, and transformation. The growth edge is not to coast on the ease."
}
