{
  "id": "neptune-conjunction-south-node",
  "transiting": "neptune",
  "aspect": "conjunction",
  "other": "south-node",
  "base": "Nostalgia can make an old pattern feel more beautiful than it was to live through.",
  "business": "The two concerns arrive in the same decision; work with the point they now share.",
  "shadow": "Because both concerns are active at once, acting on one can obscure what the other still needs.",
  "arcApplying": "The two concerns become harder to separate as exactness approaches.",
  "arcSeparating": "The fused emphasis begins to loosen after exactness.",
  "voiceNeutral": true,
  "status": "LIVE",
  "readerCopy": {
    "summary": "Nostalgia can make an old pattern feel more beautiful than it was to live through.",
    "body": "Nostalgia can make an old pattern feel more beautiful than it was to live through. Neptune conjunct the South Node can blur the line between meaningful memory and selective memory, especially around a person, dream, role, or chapter you once wanted badly. You may remember the promise and forget the daily cost. The feeling can still tell you something important about what mattered. Just do not use longing as evidence that the old arrangement should be restored exactly as it was.",
    "approvedVia": "exact owner-approved South Node Calendar batch sky-calendar-south-node-60-v1; packages/astro-knowledge/review/sky-calendar-south-node-60-v1/owner-batch-authorization.json; serving authorized by packages/astro-knowledge/review/sky-calendar-south-node-60-v1/owner-serving-authorization.json"
  }
}
