{
  "id": "jupiter-sextile-lilith",
  "transiting": "jupiter",
  "aspect": "sextile",
  "other": "lilith",
  "base": "An unconventional option can become much more practical when support arrives from people or resources that were never part of the original approval system.",
  "business": "A workable option is available; use the move that connects the two concerns.",
  "shadow": "The opportunity can remain unused if nobody makes the concrete move it requires.",
  "arcApplying": "The workable option becomes easier to recognize as exactness approaches.",
  "arcSeparating": "The opening becomes less immediate after exactness.",
  "voiceNeutral": true,
  "status": "LIVE",
  "readerCopy": {
    "summary": "An unconventional option can become much more practical when support arrives from people or resources that were never part of the original approval system.",
    "body": "An unconventional option can become much more practical when support arrives from people or resources that were never part of the original approval system. When Jupiter sextiles Lilith, expansion and autonomy cooperate through money, education, publicity, travel, introductions, or help from the right person. The surprise can be discovering that the people who taught everyone to expect rejection were never the only people whose support mattered. The idea can grow as far as evidence and resources justify without being made smaller first.",
    "approvedVia": "bounded owner-approved collective Calendar batch sky-calendar-collective-approved-2026-09-07; packages/astro-knowledge/review/sky-calendar-collective-approved-2026-09-07/owner-batch-authorization.json; serving and Content Studio authorized by packages/astro-knowledge/review/sky-calendar-collective-approved-2026-09-07/owner-serving-authorization.json"
  }
}
