{
  "id": "venus-square-jupiter",
  "transiting": "venus",
  "aspect": "square",
  "other": "jupiter",
  "tldr": "Venus square Jupiter.",
  "traditional": "A hard contact. Love, money, and pleasure works against growth, fortune, and patronage - obstruction, friction, and strained outcomes in these areas. Two benefics: among the easiest contacts, though it can incline to excess.",
  "modern": "Pleasure meets expansion. Gentleness, generosity, sensitivity, and a great deal of ease. Psychologically the square is inner tension to integrate: Play-before-work and indulgence undercut accomplishment. The growth is owning both sides instead of splitting them.",
  "cyclic": {
    "phase": "First / Last Quarter",
    "waxing": "Crisis of action: take conscious hold and build a durable form for connection against growth, or be thrown off course.",
    "waning": "Crisis of meaning: break down the connection/growth form that has outlived its purpose and reorient toward the next cycle."
  },
  "business": "Friction in this area. Likable and fortunate; the missing ingredient is discipline.",
  "shadow": "Indulgence and vanity collides with excess and overreach; forcing or splitting it instead of working it through.",
  "arcApplying": "Friction builds toward a forced adjustment.",
  "arcSeparating": "The crisis passes; what was restructured settles.",
  "composedFrom": [
    "pair:venus-jupiter",
    "aspect:square"
  ],
  "provenance": {
    "traditional": "classical and traditional sources",
    "modern": "modern aspect cookbook (psychological / popular register)",
    "cyclic": "humanistic / process-oriented source (cyclic model)"
  },
  "voiceNeutral": true,
  "status": "LIVE",
  "base": "Too much of a good thing becomes visible once every extra yes starts asking for money, time, or energy nobody intended to spend.",
  "readerCopy": {
    "summary": "Too much of a good thing becomes visible once every extra yes starts asking for money, time, or energy nobody intended to spend.",
    "body": "Too much of a good thing becomes visible once every extra yes starts asking for money, time, or energy nobody intended to spend. When Venus squares Jupiter, generosity and appetite create friction, making another upgrade, invitation, purchase, promise, or person easy to add because each choice looks harmless alone. The cost eventually appears in the part of life expected to absorb all that abundance. More stops being better when maintaining it leaves less room to enjoy what was already good.",
    "approvedVia": "bounded owner-approved collective Calendar batch sky-calendar-collective-approved-2026-09-07; packages/astro-knowledge/review/sky-calendar-collective-approved-2026-09-07/owner-batch-authorization.json; serving and Content Studio authorized by packages/astro-knowledge/review/sky-calendar-collective-approved-2026-09-07/owner-serving-authorization.json"
  }
}
