{
  "id": "jupiter-opposition-saturn",
  "transiting": "jupiter",
  "aspect": "opposition",
  "other": "saturn",
  "tldr": "Jupiter opposition Saturn.",
  "traditional": "A hard contact. Growth, fortune, and patronage works against limitation, delay, and hard structure - obstruction, friction, and strained outcomes in these areas. The benefic Jupiter tempers the malefic Saturn.",
  "modern": "Expansion meets contraction. The swing between optimism and restraint, growth and discipline. Psychologically the opposition is inner tension to integrate: Lurching between extremes, from let-loose to grind, without a steady middle. The growth is owning both sides instead of splitting them.",
  "cyclic": {
    "phase": "Full (culmination)",
    "meaning": "Growth and limit reach full awareness and face each other: culmination, objectivity, fulfillment or confrontation."
  },
  "business": "Friction in this area. Balancing risk against prudence; unmanaged, it reads as inconsistency.",
  "shadow": "Excess and overreach collides with fear and rigidity; forcing or splitting it instead of working it through.",
  "arcApplying": "A confrontation builds; the other side comes fully into view.",
  "arcSeparating": "The standoff resolves into balance or a split.",
  "composedFrom": [
    "pair:jupiter-saturn",
    "aspect:opposition"
  ],
  "provenance": {
    "traditional": "classical and traditional sources",
    "modern": "modern aspect cookbook (psychological / popular register)",
    "cyclic": "humanistic / process-oriented source (cyclic model)"
  },
  "voiceNeutral": true,
  "status": "LIVE",
  "base": "A larger possibility can become frustrating when a rule, budget, deadline, or responsibility keeps saying not yet.",
  "readerCopy": {
    "summary": "A larger possibility can become frustrating when a rule, budget, deadline, or responsibility keeps saying not yet.",
    "body": "A larger possibility can become frustrating when a rule, budget, deadline, or responsibility keeps saying not yet. When Jupiter opposes Saturn, expansion meets a limit that cannot be talked away simply because the outcome looks promising. If a delay is getting under your skin, you may find it useful to notice what the restriction is actually revealing about capacity, timing, or responsibility. Some limits are unnecessary; others show the part of the plan that still cannot carry what is being asked of it.",
    "approvedVia": "bounded owner-approved collective Calendar batch sky-calendar-collective-approved-2026-09-07; packages/astro-knowledge/review/sky-calendar-collective-approved-2026-09-07/owner-batch-authorization.json; serving and Content Studio authorized by packages/astro-knowledge/review/sky-calendar-collective-approved-2026-09-07/owner-serving-authorization.json"
  }
}
