{
  "id": "venus-conjunction-pluto",
  "transiting": "venus",
  "aspect": "conjunction",
  "other": "pluto",
  "tldr": "Venus conjunction Pluto.",
  "traditional": "No classical doctrine: Pluto is a modern planet unknown to traditional astrology. Read from the modern and cyclic layers; treat this contact as a slow, generational background tone.",
  "modern": "Love and value meet intensity. All-or-nothing attraction, deep desire, and a strong pull toward control in relationships. Fused, these drives are difficult to separate and ask to be consciously integrated rather than acted out blindly.",
  "cyclic": {
    "phase": "New (seed)",
    "meaning": "A new cycle of connection and power is sown: instinctive, full of potential, not yet conscious of itself."
  },
  "business": "Concentrated focus in this area. Magnetic and persuasive; the intensity has to be moderated.",
  "shadow": "Indulgence and vanity fused with control and obsession, with no distance to tell them apart.",
  "arcApplying": "The two fuse and intensify as they close in.",
  "arcSeparating": "The fused theme peaks and discharges.",
  "composedFrom": [
    "pair:venus-pluto",
    "aspect:conjunction"
  ],
  "provenance": {
    "traditional": "classical and traditional sources",
    "modern": "modern aspect cookbook (psychological / popular register)",
    "cyclic": "humanistic / process-oriented source (cyclic model)"
  },
  "voiceNeutral": true,
  "status": "DRAFT",
  "base": "Love and value meet intensity. All-or-nothing attraction, deep desire, and a strong pull toward control in relationships. Fused, these drives are difficult to separate and ask to be consciously integrated rather than acted out blindly."
}
