{
  "id": "moon-sextile-south-node",
  "transiting": "moon",
  "aspect": "sextile",
  "other": "south-node",
  "base": "A familiar source of comfort can help, especially if you do not confuse relief with a solution.",
  "business": "A workable option is available; use the move that connects the two concerns.",
  "shadow": "The opportunity can remain unused if nobody makes the concrete move it requires.",
  "arcApplying": "The workable option becomes easier to recognize as exactness approaches.",
  "arcSeparating": "The opening becomes less immediate after exactness.",
  "voiceNeutral": true,
  "status": "LIVE",
  "readerCopy": {
    "summary": "A familiar source of comfort can help, especially if you do not confuse relief with a solution.",
    "body": "A familiar source of comfort can help, especially if you do not confuse relief with a solution. The Moon sextile the South Node can make an old routine, family connection, home ritual, or emotional skill easier to reach. Returning to something known may give you enough steadiness to deal with what is happening instead of reacting from the middle of it. Take the support. Just notice if the comforting choice also helps you avoid the conversation, change, or decision that still needs to happen.",
    "approvedVia": "exact owner-approved South Node Calendar batch sky-calendar-south-node-60-v1; packages/astro-knowledge/review/sky-calendar-south-node-60-v1/owner-batch-authorization.json; serving authorized by packages/astro-knowledge/review/sky-calendar-south-node-60-v1/owner-serving-authorization.json"
  }
}
