{
  "id": "venus-trine-saturn",
  "transiting": "venus",
  "aspect": "trine",
  "other": "saturn",
  "tldr": "Venus trine Saturn.",
  "traditional": "A soft contact. Love, money, and pleasure supports limitation, delay, and hard structure - cooperation and favorable conditions in these areas. The benefic Venus tempers the malefic Saturn.",
  "modern": "Affection and value meet limit. Loyalty, restraint in pleasure and love, and a strong sense of obligation. The trine makes this a natural strength: Committed, steady, and loyal in relationships and finances. The growth edge is not to coast on the ease.",
  "cyclic": {
    "phase": "Waxing / waning trine",
    "waxing": "Connection and limit flow together with ease; respond to the opportunity.",
    "waning": "Distribute and give transmissible form to what connection and limit have realized."
  },
  "business": "An opening in this area. Loyal and hardworking; the risk is joyless striving and a belief that reward must be suffered for.",
  "shadow": "The ease lets indulgence and vanity and fear and rigidity go unchecked, or the opening pass unused.",
  "arcApplying": "Ease and support build and arrive on their own.",
  "arcSeparating": "The ease withdraws; the flow passes, used or not.",
  "composedFrom": [
    "pair:venus-saturn",
    "aspect:trine"
  ],
  "provenance": {
    "traditional": "classical and traditional sources",
    "modern": "modern aspect cookbook (psychological / popular register)",
    "cyclic": "humanistic / process-oriented source (cyclic model)"
  },
  "voiceNeutral": true,
  "status": "LIVE",
  "base": "Commitment becomes easier to trust when knowing what it requires does not make the choice less appealing.",
  "readerCopy": {
    "summary": "Commitment becomes easier to trust when knowing what it requires does not make the choice less appealing.",
    "body": "Commitment becomes easier to trust when knowing what it requires does not make the choice less appealing. When Venus trines Saturn, affection, value, and responsibility reinforce each other, making time, money, limits, and obligations easier to consider without stripping the meaning from the decision. Practical details can strengthen the choice by showing what ordinary life will actually ask each person to contribute.",
    "approvedVia": "bounded owner-approved collective Calendar batch sky-calendar-collective-approved-2026-09-07; packages/astro-knowledge/review/sky-calendar-collective-approved-2026-09-07/owner-batch-authorization.json; serving and Content Studio authorized by packages/astro-knowledge/review/sky-calendar-collective-approved-2026-09-07/owner-serving-authorization.json"
  }
}
