{
  "id": "sun-trine-uranus",
  "transiting": "sun",
  "aspect": "trine",
  "other": "uranus",
  "tldr": "the Sun trine Uranus.",
  "traditional": "No classical doctrine: Uranus is a modern planet unknown to traditional astrology. Read from the modern and cyclic layers; treat this contact as a slow, generational background tone.",
  "modern": "Identity meets independence and disruption. The urge to be different and to do things your own way. The trine makes this a natural strength: Originality that reads as brilliance or healthy independence. The growth edge is not to coast on the ease.",
  "cyclic": {
    "phase": "Waxing / waning trine",
    "waxing": "Selfhood and disruption flow together with ease; respond to the opportunity.",
    "waning": "Distribute and give transmissible form to what selfhood and disruption have realized."
  },
  "business": "An opening in this area. Suited to independent or innovative work where you aren't boxed in.",
  "shadow": "The ease lets egotism and needing to be the center and instability for its own sake go unchecked, or the opening pass unused.",
  "arcApplying": "Ease and support build and arrive on their own.",
  "arcSeparating": "The ease withdraws; the flow passes, used or not.",
  "composedFrom": [
    "pair:sun-uranus",
    "aspect:trine"
  ],
  "provenance": {
    "traditional": "classical and traditional sources",
    "modern": "modern aspect cookbook (psychological / popular register)",
    "cyclic": "humanistic / process-oriented source (cyclic model)"
  },
  "voiceNeutral": true,
  "status": "LIVE",
  "base": "A change can feel more meaningful when it creates more authenticity rather than simply more excitement.",
  "readerCopy": {
    "summary": "A change can feel more meaningful when it creates more authenticity rather than simply more excitement.",
    "body": "A change can feel more meaningful when it creates more authenticity rather than simply more excitement. When the Sun trines Uranus, purpose and experimentation reinforce each other, making a different routine, role, method, or identity easier to try without destroying everything familiar. The unfamiliar option may fit better because the people living inside the old structure have changed. The useful adjustment is the one that creates more freedom and still makes sense after the novelty passes.",
    "approvedVia": "bounded owner-approved collective Calendar batch sky-calendar-collective-approved-2026-09-07; packages/astro-knowledge/review/sky-calendar-collective-approved-2026-09-07/owner-batch-authorization.json; serving and Content Studio authorized by packages/astro-knowledge/review/sky-calendar-collective-approved-2026-09-07/owner-serving-authorization.json"
  }
}
