{
  "id": "pluto-square-north-node",
  "transiting": "pluto",
  "aspect": "square",
  "other": "north-node",
  "base": "A necessary change can still be blocked by the person or system controlling the money, access, information, or terms required to carry it out.",
  "business": "A practical mismatch needs adjustment; change the arrangement instead of repeating the same workaround.",
  "shadow": "Pressure escalates when each side keeps demanding terms the other cannot sustain.",
  "arcApplying": "The mismatch becomes harder to work around as exactness approaches.",
  "arcSeparating": "The pressure eases after exactness, leaving the changed arrangement to prove itself.",
  "voiceNeutral": true,
  "status": "LIVE",
  "readerCopy": {
    "summary": "A necessary change can still be blocked by the person or system controlling the money, access, information, or terms required to carry it out.",
    "body": "A necessary change can still be blocked by the person or system controlling the money, access, information, or terms required to carry it out. When Pluto squares the North Node, power and forward movement create friction, making dependence itself part of the obstacle. More pressure is not always more leverage. The path becomes clearer once what can be withheld, which alternatives exist, and what would reduce dependence are identified before the struggle is allowed to define the entire future.",
    "approvedVia": "bounded owner-approved collective Calendar batch sky-calendar-collective-approved-2026-09-07; packages/astro-knowledge/review/sky-calendar-collective-approved-2026-09-07/owner-batch-authorization.json; serving and Content Studio authorized by packages/astro-knowledge/review/sky-calendar-collective-approved-2026-09-07/owner-serving-authorization.json"
  }
}
